UC1 :- Create a payroll service database

mysql> create database payroll_service;
Query OK, 1 row affected (2.12 sec)

mysql> show databases;
+--------------------+
| Database           |
+--------------------+
| information_schema |
| mysql              |
| payroll_service    |
| performance_schema |
| sys                |
+--------------------+
5 rows in set (0.59 sec)

mysql> use payroll_service;
Database changed

UC2 :- create table employee payroll in payroll service database
mysql>  create table employee_payroll(
    -> id int unsigned not null auto_increment,
    -> name varchar(100) not null,
    -> salary double not null,
    -> start_date date not null,
    -> primary key(id));
Query OK, 0 rows affected (2.70 sec)

mysql> desc employee_payroll;
+------------+--------------+------+-----+---------+----------------+
| Field      | Type         | Null | Key | Default | Extra          |
+------------+--------------+------+-----+---------+----------------+
| id         | int unsigned | NO   | PRI | NULL    | auto_increment |
| name       | varchar(100) | NO   |     | NULL    |                |
| salary     | double       | NO   |     | NULL    |                |
| start_date | date         | NO   |     | NULL    |                |
+------------+--------------+------+-----+---------+----------------+
4 rows in set (0.42 sec)

UC3 :- Create employee payroll data in payroll service database as part of CURD operation
mysql> insert into employee_payroll(name, salary, start_date)values('Bill', 1000000.00, '2010-10-30'),('Tersia',2000000.00, '2019-11-13'), ('Charlie', 3000000.00, '2020-05-21');
Query OK, 3 rows affected (0.70 sec)
Records: 3  Duplicates: 0  Warnings: 0

UC4 :- Retrive all employee payroll data from employee payroll teble
mysql> select * from employee_payroll
    -> ;
+----+---------+---------+------------+
| id | name    | salary  | start_date |
+----+---------+---------+------------+
|  1 | Bill    | 1000000 | 2010-10-30 |
|  2 | Tersia  | 2000000 | 2019-11-13 |
|  3 | Charlie | 3000000 | 2020-05-21 |
+----+---------+---------+------------+
3 rows in set (0.03 sec)

UC5 :- Retrieve salary data for particular employee as well as employee particular data range
mysql> select salary from employee_payroll where name = 'Bill'
    -> ;
+---------+
| salary  |
+---------+
| 1000000 |
+---------+
1 row in set (0.08 sec)

mysql> select start_date from employee_payroll where start_date between cast('2018-01-01' as date) and date(now());
+------------+
| start_date |
+------------+
| 2019-11-13 |
| 2020-05-21 |
+------------+
2 rows in set (0.10 sec)

UC6 :- Add Gender to employee payroll table and update rows to reflect correct employee gender
mysql> alter table employee_payroll add gender varchar(1) after name;
Query OK, 0 rows affected (1.85 sec)
Records: 0  Duplicates: 0  Warnings: 0

mysql> select * from employee_payroll
    -> ;
+----+---------+--------+---------+------------+
| id | name    | gender | salary  | start_date |
+----+---------+--------+---------+------------+
|  1 | Bill    | NULL   | 1000000 | 2010-10-30 |
|  2 | Tersia  | NULL   | 2000000 | 2019-11-13 |
|  3 | Charlie | NULL   | 3000000 | 2020-05-21 |
+----+---------+--------+---------+------------+
3 rows in set (0.00 sec)

mysql> update employee_payroll set gender = 'M' where name = 'Bill' or name = 'Charlie';
Query OK, 2 rows affected (0.12 sec)
Rows matched: 2  Changed: 2  Warnings: 0

mysql> update employee_payroll set gender = 'F' where name = 'Tersia';
Query OK, 1 row affected (0.05 sec)
Rows matched: 1  Changed: 1  Warnings: 0

mysql> select * from employee_payroll;
+----+---------+--------+---------+------------+
| id | name    | gender | salary  | start_date |
+----+---------+--------+---------+------------+
|  1 | Bill    | M      | 1000000 | 2010-10-30 |
|  2 | Tersia  | F      | 2000000 | 2019-11-13 |
|  3 | Charlie | M      | 3000000 | 2020-05-21 |
+----+---------+--------+---------+------------+
3 rows in set (0.00 sec) 

UC7 :- Find sum, avg, min, max, count to do analysis by male or female
mysql> select sum(salary) from employee_payroll where gender = 'M' group by gender;
+-------------+
| sum(salary) |
+-------------+
|     4000000 |
+-------------+
1 row in set (0.04 sec)

mysql> select avg(salary) from employee_payroll where gender = 'M' group by gender;
+-------------+
| avg(salary) |
+-------------+
|     2000000 |
+-------------+
1 row in set (0.00 sec)

mysql> select min(salary) from employee_payroll where gender = 'M' group by gender;
+-------------+
| min(salary) |
+-------------+
|     1000000 |
+-------------+
1 row in set (0.08 sec)

mysql> select max(salary) from employee_payroll where gender = 'F' group by gender;
+-------------+
| max(salary) |
+-------------+
|     2000000 |
+-------------+
1 row in set (0.00 sec)

mysql> select count(salary) from employee_payroll where gender = 'F' group by gender;
+---------------+
| count(salary) |
+---------------+
|             1 |
+---------------+
1 row in set (0.00 sec)

mysql> select count(salary) from employee_payroll where gender = 'M' group by gender;
+---------------+
| count(salary) |
+---------------+
|             2 |
+---------------+
1 row in set (0.00 sec)